<?xml version="1.0" encoding="UTF-8"?>
<!DOCTYPE Library SYSTEM "library.dtd" >
<Library>
    <publishing_houses>

        <publishing_house publishing_house_id="ph7">
            <publishing_house_name>Horror Press</publishing_house_name>
            <year>1980</year>
            <address>New Jersey, st Dwark 15</address>
            <email>horror@gmail.com</email>
        </publishing_house>

        <publishing_house publishing_house_id="ph8">
            <publishing_house_name>Medium</publishing_house_name>
            <year>2004</year>
            <address>Sofia, st Ignatiev 38</address>
            <email>Medium@gmail.com</email>
        </publishing_house>

    </publishing_houses>

    <books>

        <book book_id="b1" publishing_house_id="ph8" author_id="a1">
            <book_title>The Bassoon King</book_title>
            <pages>397</pages>
            <genre>Biography</genre>
            <language>English</language>
        </book>

	<book book_id="b2" publishing_house_id="ph8" author_id="a2">
            <book_title>Lee Miller: A Woman's War</book_title>
            <pages>229</pages>
            <genre>History </genre>
            <language>English</language>
        </book>
	
	<book book_id="b3" publishing_house_id="ph7" author_id="a3">
            <book_title>Nueve monedas</book_title>
            <pages>156</pages>
            <genre>Poetry</genre>
            <language>French</language>
        </book>

	<book book_id="b4" publishing_house_id="ph8" author_id="a4">
            <book_title>Ashley Bell</book_title>
            <pages>245</pages>
            <genre>Fantasy</genre>
            <language>English</language>
        </book>

	<book book_id="b5" publishing_house_id="ph7" author_id="a5">
            <book_title>The Stone Reader</book_title>
            <pages>356</pages>
            <genre>Philosophy</genre>
            <language>Italian</language>
        </book>
	
	<book book_id="b6" publishing_house_id="ph8" author_id="a6">
            <book_title>The Little Book of Vargas</book_title>
            <pages>368</pages>
            <genre>Art</genre>
            <language>English</language>
        </book>

	<book book_id="b7" publishing_house_id="ph7" author_id="a7">
            <book_title>For the Record </book_title>
            <pages>238</pages>
            <genre>Music</genre>
            <language>English</language>
        </book>

	<book book_id="b8" publishing_house_id="ph7" author_id="a8">
            <book_title>Ten Billion Tomorrows</book_title>
            <pages>435</pages>
            <genre>Science</genre>
            <language>English</language>
        </book>

    </books>

    <authors>

        <author author_id="a1">
            <name>
                <first_name>Rainn</first_name>
                <last_name>Wilson</last_name>
            </name>
            <email>wilson@yahoo.com</email>
            <nationality>American</nationality>
            <gender>Male</gender>
            <age>41</age>
        </author>

        <author author_id="a2">
            <name>
                <first_name>Hilary</first_name>
                <last_name>Roberts</last_name>
            </name>
            <email>roberts.n@yahoo.com</email>
            <nationality>American</nationality>
            <gender>Female</gender>
            <age>62</age>
        </author>

        <author author_id="a3">
            <name>
                <first_name>Carlos</first_name>
                <last_name>Pintado</last_name>
            </name>
            <email>pintado@guen.fr</email>
            <nationality>French</nationality>
            <gender>Male</gender>
            <age>34</age>
        </author>

        <author author_id="a4">
            <name>
                <first_name>Dean</first_name>
                <last_name>Koontz</last_name>
            </name>
            <email>koontzgroup@abv.bg</email>
            <nationality>American</nationality>
            <gender>Male</gender>
            <age>46</age>
        </author>

        <author author_id="a5">
            <name>
                <first_name>Peter</first_name>
                <last_name>Catapano</last_name>
            </name>
            <email>catapano.p@yahoo.com</email>
            <nationality>Italian</nationality>
            <gender>Male</gender>
            <age>57</age>
        </author>

        <author author_id="a6">
            <name>
                <first_name>Dian</first_name>
                <last_name>Hanson</last_name>
            </name>
            <email>hansonsed@yahoo.com</email>
            <nationality>American</nationality>
            <gender>Female</gender>
            <age>28</age>
        </author>

        <author author_id="a7">
            <name>
                <first_name>Charlotte</first_name>
                <last_name>Huang</last_name>
            </name>
            <email>chatlotte_h@yahoo.com</email>
            <nationality>American</nationality>
            <gender>Female</gender>
            <age>24</age>
        </author>

        <author author_id="a8">
            <name>
                <first_name>Brian</first_name>
                <last_name>Clegg</last_name>
            </name>
            <email>brian.clegg@yahoo.com</email>
            <nationality>American</nationality>
            <gender>Male</gender>
            <age>46</age>
        </author>


    </authors>
</Library>
