<?xml version="1.0" encoding="UTF-8"?>
<!DOCTYPE Library SYSTEM "library.dtd" >
<Library>
    <publishing_houses>

        <publishing_house publishing_house_id="ph5">
            <publishing_house_name>Action Press</publishing_house_name>
            <year>1980</year>
            <address>New York, st Dwark 15</address>
            <email>action@gmail.com</email>
        </publishing_house>

        <publishing_house publishing_house_id="ph6">
            <publishing_house_name>Small</publishing_house_name>
            <year>2004</year>
            <address>Sofia, st Garibaldi 38</address>
            <email>small@gmail.com</email>
        </publishing_house>

    </publishing_houses>

    <books>

        <book book_id="b1" publishing_house_id="ph6" author_id="a1">
            <book_title>Drawing Blood</book_title>
            <pages>399</pages>
            <genre>Biography</genre>
            <language>English</language>
        </book>

	<book book_id="b2" publishing_house_id="ph6" author_id="a2">
            <book_title>First Bite</book_title>
            <pages>229</pages>
            <genre>History </genre>
            <language>English</language>
        </book>
	
	<book book_id="b3" publishing_house_id="ph5" author_id="a3">
            <book_title>The Paris Review Issue 215</book_title>
            <pages>156</pages>
            <genre>Poetry</genre>
            <language>French</language>
        </book>

	<book book_id="b4" publishing_house_id="ph6" author_id="a4">
            <book_title>Frozen Tides</book_title>
            <pages>245</pages>
            <genre>Fantasy</genre>
            <language>English</language>
        </book>

	<book book_id="b5" publishing_house_id="ph5" author_id="a5">
            <book_title>Fighting God</book_title>
            <pages>356</pages>
            <genre>Philosophy</genre>
            <language>English</language>
        </book>
	
	<book book_id="b6" publishing_house_id="ph6" author_id="a6">
            <book_title>Asia in Amsterdam</book_title>
            <pages>368</pages>
            <genre>Art</genre>
            <language>Japanese</language>
        </book>

	<book book_id="b7" publishing_house_id="ph5" author_id="a7">
            <book_title>Boys in the Trees</book_title>
            <pages>238</pages>
            <genre>Music</genre>
            <language>English</language>
        </book>

	<book book_id="b8" publishing_house_id="ph5" author_id="a8">
            <book_title>The Story Without an End</book_title>
            <pages>435</pages>
            <genre>Classic</genre>
            <language>English</language>
        </book>

    </books>

    <authors>

        <author author_id="a1">
            <name>
                <first_name>Molly</first_name>
                <last_name>Crabapple</last_name>
            </name>
            <email>molly.crbooks@yahoo.com</email>
            <nationality>American</nationality>
            <gender>Female</gender>
            <age>41</age>
        </author>

        <author author_id="a2">
            <name>
                <first_name>Bee</first_name>
                <last_name>Wilson</last_name>
            </name>
            <email>wilsons.en@yahoo.com</email>
            <nationality>American</nationality>
            <gender>Male</gender>
            <age>62</age>
        </author>

        <author author_id="a3">
            <name>
                <first_name>Lorin</first_name>
                <last_name>Stein</last_name>
            </name>
            <email>lorin_books@guen.fr</email>
            <nationality>French</nationality>
            <gender>Male</gender>
            <age>34</age>
        </author>

        <author author_id="a4">
            <name>
                <first_name>Morgan</first_name>
                <last_name>Rhodes</last_name>
            </name>
            <email>rhodesshouse@abv.bg</email>
            <nationality>American</nationality>
            <gender>Male</gender>
            <age>46</age>
        </author>

        <author author_id="a5">
            <name>
                <first_name>David</first_name>
                <last_name>Silverman</last_name>
            </name>
            <email>david_s@yahoo.com</email>
            <nationality>Australian</nationality>
            <gender>Male</gender>
            <age>57</age>
        </author>

        <author author_id="a6">
            <name>
                <first_name>Jan van</first_name>
                <last_name>Campen</last_name>
            </name>
            <email>campen.j@yahoo.com</email>
            <nationality>Japanese</nationality>
            <gender>Male</gender>
            <age>28</age>
        </author>

        <author author_id="a7">
            <name>
                <first_name>Carly</first_name>
                <last_name>Simon</last_name>
            </name>
            <email>carlies@yahoo.com</email>
            <nationality>American</nationality>
            <gender>Male</gender>
            <age>24</age>
        </author>

        <author author_id="a8">
            <name>
                <first_name>Sarah</first_name>
                <last_name>Austin</last_name>
            </name>
            <email>austinsar@yahoo.com</email>
            <nationality>American</nationality>
            <gender>Female</gender>
            <age>46</age>
        </author>


    </authors>
</Library>
